{
  "schemaVersion": 1,
  "id": "synthesis-writing",
  "type": "writing",
  "profile": "final-synthesis",
  "binding": {
    "assembledFlag": "synthesis-assembled",
    "modelFlag": "synthesis-model-viewed"
  },
  "data": {
    "fields": [
      {
        "id": "synthesis-contributors",
        "formatKey": "contributors",
        "label": "Which participants' ideas are you connecting?",
        "multiline": true,
        "readonly": false,
        "rows": 2
      },
      {
        "id": "synthesis-relationship",
        "formatKey": "relationship",
        "label": "What relationship do you see between their ideas?",
        "multiline": true,
        "readonly": false,
        "rows": 2
      },
      {
        "id": "synthesis-recommendation",
        "formatKey": "recommendation",
        "label": "What new recommendation follows?",
        "multiline": true,
        "readonly": false,
        "rows": 2
      }
    ],
    "output": {
      "id": "synthesis-output",
      "label": "My synthesis · editable",
      "multiline": true,
      "readonly": false,
      "rows": 5
    },
    "assembly": {
      "label": "Assemble My Synthesis",
      "template": "Building on {contributors}, {relationship}. Therefore, {recommendation}",
      "missingMessage": "Complete all three fields before assembling.",
      "successMessage": "Assembled. You can edit the paragraph below.",
      "focusOutput": false
    },
    "copyLabel": "Copy My Synthesis",
    "model": {
      "mode": "show-only",
      "showLabel": "Compare with Model",
      "blocks": [
        {
          "kind": "title",
          "text": "Model synthesis"
        },
        {
          "kind": "paragraph",
          "text": "“Building on Maya's transportation proposal and Jordan's concern about costs, we could recommend a limited transportation pilot before committing to a larger program. Sam's suggestion to test solutions would help us evaluate the pilot, while Avery's communication idea could ensure students know the service is available.”"
        },
        {
          "kind": "paragraph",
          "text": "This credits contributors, connects perspectives, addresses costs, develops a coordinated recommendation, and advances the task."
        }
      ]
    },
    "copyMessages": {
      "empty": "Write a response before copying."
    },
    "edit": {
      "label": "Edit Response",
      "message": "Edit your fields, then assemble again when ready."
    },
    "actionOrder": "edit-copy-model",
    "outputReveal": "assembled"
  }
}
